{
  "condition_id": "best_qlora_fixture",
  "backend": "qlora",
  "task_id": "actor_ping",
  "attempts": 1,
  "compile_pass_1": true,
  "compile_pass_n": true,
  "repair_depth": 0,
  "canonical_pass": true,
  "voxelized_strictness": true,
  "task_success": true,
  "semantic_task_success": true,
  "hir_error_count": 0,
  "latency_ms": 50,
  "time_to_first_valid_ms": 50,
  "repair_stalled": false,
  "tokens_in": 12,
  "tokens_out": 18,
  "placeholder_marker_hits": 0,
  "trivial_placeholder_output": false,
  "construct_richness_score": 0.4,
  "anti_stub_pass": true
}
